StartDate,EndDate,Status,Progress,Duration (in seconds),Finished,RecordedDate,ResponseId,DistributionChannel,UserLanguage,Consent_Contact,Consent,AC1,Race_Ethn1,Race_Ethn2,HL_Origin_1,BIC_1,LANG_1,AGE,LANG_O,INCOME,SES_ladder,EDUC_Par,EDUC_Self,GENDER,GENDER_6_TEXT,SEXOR,SEXOR_7_TEXT,MILIT,MILIT_7_TEXT,DIS_1,DIS_1_8_TEXT,PROMIS_Global1_1,PROMIS_Global1_2,PROMIS_Global1_3,PROMIS_Global1_4,PROMIS_Global1_5,PROMIS_Global1_6,PROMIS_Global1_7,PROMIS_Global2_1,PROMIS_Global2_2,PROMIS_Global3_1,GHSQL_Pers_1,GHSQL_Pers_2,GHSQL_Pers_3,GHSQL_Pers_4,GHSQL_Pers_5,GHSQL_Pers_6,GHSQL_Pers_7,GHSQL_Pers_8,GHSQL_Pers_9,GHSQL_Pers_10,GHSQL_Pers_10_TEXT,GHSQL_SUI_1,GHSQL_SUI_2,GHSQL_SUI_3,GHSQL_SUI_4,GHSQL_SUI_5,GHSQL_SUI_6,GHSQL_SUI_7,GHSQL_SUI_8,GHSQL_SUI_9,GHSQL_SUI_10,GHSQL_SUI_10_TEXT,GHSQ_RankPers_1,GHSQ_RankPers_2,GHSQ_RankPers_3,GHSQ_RankPers_4,GHSQ_RankPers_5,GHSQ_RankPers_6,GHSQ_RankPers_7,GHSQ_RankPers_8,GHSQ_RankPers_9,GHSQ_RankPers_10,GHSQ_RankPers_10_TEXT,GHSQO_RankSUI_1,GHSQO_RankSUI_2,GHSQO_RankSUI_3,GHSQO_RankSUI_4,GHSQO_RankSUI_5,GHSQO_RankSUI_6,GHSQO_RankSUI_7,GHSQO_RankSUI_8,GHSQO_RankSUI_9,GHSQO_RankSUI_10,GHSQO_RankSUI_10_TEXT,tx_history,tx_history_o,TRS_1,TRS_2,TRS_3,TRS_4,TRS_5,TRS_6,TRS_7,TRS_8,TRS_O,Trust_ipip_prof_1,Trust_ipip_prof_2,Trust_ipip_prof_3,Trust_ipip_prof_4,Trust_ipip_prof_5,Trust_ipip_prof_6,Trust_ipip_friend_1,Trust_ipip_friend_2,Trust_ipip_friend_3,Trust_ipip_friend_4,Trust_ipip_friend_5,Trust_ipip_friend_6,RAS_Friend_IP_1,RAS_Friend_IP_2,RAS_Friend_IP_3,RAS_Friend_IP_4,RAS_Friend_IP_5,RAS_Friend_IP_6,RAS_Friend_IP_7,Trust_IPIP_Family_1,Trust_IPIP_Family_2,Trust_IPIP_Family_3,Trust_IPIP_Family_4,Trust_IPIP_Family_5,Trust_IPIP_Family_6,RAS_fam_1,RAS_fam_2,RAS_fam_3,RAS_fam_4,RAS_fam_5,RAS_fam_6,RAS_fam_7,DASS21_1,DASS21_2,DASS21_3,DASS21_4,DASS21_5,DASS21_6,DASS21_7,DASS21_8,DASS21_9,DASS21_10,DASS21_11,DASS21_12,DASS21_13,DASS21_14,DASS21_15,DASS21_16,DASS21_17,DASS21_18,DASS21_19,DASS21_20,DASS21_21,ISMI29_1,ISMI29_2,ISMI29_3,ISMI29_4,ISMI29_5,ISMI29_6,ISMI29_7,ISMI29_8,ISMI29_9,ISMI29_10,ISMI29_11,ISMI29_12,ISMI29_13,ISMI29_14,ISMI29_15,ISMI29_16,ISMI29_17,ISMI29_18,ISMI29_19,ISMI29_20,ISMI29_21,ISMI29_22,ISMI29_23,ISMI29_24,ISMI29_25,ISMI29_26,ISMI29_27,ISMI29_28,ISMI29_29,DDI_1,DDI_2,DDI_3,DDI_4,DDI_5,DDI_6,DDI_7,DDI_8,DDI_9,DDI_10,DDI_11,DDI_12,AC2,BFNE_1,BFNE_2,BFNE_3,BFNE_4,BFNE_5,BFNE_6,BFNE_7,BFNE_8,BFNE_9,BFNE_10,BFNE_11,BFNE_12,TPS_1,TPS_2,TPS_3,TPS_4,TPS_5,TPS_6,TPS_7,TPS_8,TPS_9,TPS_10,TPS_11,TPS_O,EIS_RE1,EIS_RE1_7_TEXT,EIS_HORIGIN,EIS_HORIGIN_3_TEXT,EIS_Ethni_1,EIS_Ethni_2,EIS_Ethni_3,EIS_Ethni_4,EIS_Ethni_5,EIS_Ethni_6,EIS_Ethni_7,EIS_Ethni_8,EIS_Ethni_9,EvIn_1_1,EvIn_1_2,EvIn_1_3,EvIn_1_4,EvIn_1_5,EvIn_2,EvIn_2_10_TEXT,BICF_1,BICF_2,BICF_3,BICF_4,BICF_5,BICF_6,BICF_7,BICII_1,BICII_2,BICII_3,BICII_4,BICII_5,BICII_6,BICII_7,BICII_8,BICII_9,BICII_10,miniIPIP12_1,miniIPIP12_2,miniIPIP12_3,miniIPIP12_4,miniIPIP12_5,miniIPIP12_6,miniIPIP12_7,miniIPIP12_8,miniIPIP12_9,miniIPIP12_10,miniIPIP12_11,miniIPIP12_12,miniIPIP12_13,AC3,TOSCA3_ 1_1,TOSCA3_1_2,TOSCA3_1_3,TOSCA3_1_4,TOSCA_2_1,TOSCA_2_2,TOSCA_2_3,TOSCA_2_4,TOSCA3_3_1,TOSCA3_3_2,TOSCA3_3_3,TOSCA3_3_4,TOSCA3_4_1,TOSCA3_4_2,TOSCA3_4_3,TOSCA3_4_4,TOSCA3_5_1,TOSCA3_5_2,TOSCA3_5_3,TOSCA3_5_4,TOSCA3_6_1,TOSCA3_6_2,TOSCA3_6_3,TOSCA3_6_4,TOSCA3_7_1,TOSCA3_7_2,TOSCA3_7_3,TOSCA3_7_4,TOSCA3_8_1,TOSCA3_8_2,TOSCA3_8_3,TOSCA3_8_4,TOSCA3_9_1,TOSCA3_9_2,TOSCA3_9_3,TOSCA3_9_4,TOSCA3_10_1,TOSCA3_10_2,TOSCA3_10_3,TOSCA3_10_4,TOSCA3_11_1,TOSCA3_11_2,TOSCA3_11_3,TOSCA3_11_4,SCS_1,SCS_2,SCS_3,SCS_4,SCS_5,SCS_6,SCS_7,SCS_8,SCS_9,SCS_10,SIAS_1,SIAS_2,SIAS_3,SIAS_4,SIAS_5,SIAS_6,SIAS_7,SIAS_8,SIAS_9,SIAS_10,SIAS_11,SIAS_12,SIAS_13,SIAS_14,SIAS_15,SIAS_16,SIAS_17,SIAS_18,SIAS_19,SIAS_20,SAFE_1,SAFE_2,SAFE_3,SAFE_4,SAFE_5,SAFE_6,SAFE_7,SAFE_8,SAFE_9,SAFE_10,SAFE_11,SAFE_12,SAFE_13,SAFE_14,SAFE_15,SAFE_16,SAFE_17,SAFE_18,SAFE_19,SAFE_20,SAFE_21,SAFE_22,SAFE_23,SAFE_24,SAFE_25,SAFE_26,SAFE_27,SAFE_28,SAFE_29,SAFE_30,SAFE_31,SAFE_32,IPIP_47_1,IPIP_47_2,IPIP_47_3,IPIP_47_4,IPIP_47_5,IPIP_47_6,IPIP_47_7,IPIP_47_8,IPIP_47_9,IPIP_47_10,IPIP_47_11,IPIP_47_12,IPIP_47_13,IPIP_47_14,IPIP_47_15,IPIP_47_16,IPIP_47_17,IPIP_47_18,IPIP_47_19,IPIP_47_20,IPIP_47_21,IPIP_47_22,IPIP_47_23,IPIP_47_24,IPIP_47_25,IPIP_47_26,IPIP_47_27,IPIP_47_28,IPIP_47_29,IPIP_47_30,IPIP_47_31,IPIP_47_32,IPIP_47_33,IPIP_47_34,IPIP_47_35,IPIP_47_36,IPIP_47_37,IPIP_47_38,IPIP_47_39,IPIP_47_40,IPIP_47_41,IPIP_47_42,IPIP_47_43,IPIP_47_44,IPIP_47_45,IPIP_47_46,IPIP_47_47,AC4,SC0,SONA_ID
Start Date,End Date,Response Type,Progress,Duration (in seconds),Finished,Recorded Date,Response ID,Distribution Channel,User Language,"Consent Form

(click to download)

Mental Health Help-Seeking Preferences in College Students



INFORMED CONSENT FORM

RESEARCH PROCEDURES

This research is being conducted to assess mental health help-seeking preferences in college students. If you agree to participate, you will be asked to complete a series of surveys about mental health and personality and answer questions about who you would be most likely to talk to about your mental health. You will also be asked to complete a few brief attention check questions throughout the study. It will take about 90 minutes to complete this study.



RISKS

The foreseeable risks or discomforts include mild psychological distress related to answering questions about mental health. This distress is expected to be no more than what you may experience discussing these topics with a family member, friend, or healthcare provider.

There is always a slight chance that someone might feel upset after completing the survey; however, it is important to know that there are no expected risks or negative effects associated with your involvement.

If you experience psychological distress, please consider contacting the GMU Center for Psychological Service's FREE Emotional Support Line at 703-215-1898. Trained providers are available every day from 8:30 AM – 8:30 PM to offer help, teach evidence-based skills, and listen. Resources for low-cost or sliding scale therapy sessions are also available upon request.

Loss of confidentiality is an unlikely but possible risk in any study involving collection of personally identifiable information. While it is understood that no computer transmission can be perfectly secure, reasonable efforts will be made to protect the confidentiality of your transmission, as described below (""Confidentiality"").

There is a risk that you could become bored or fatigued while completing the study surveys. You are welcome to take a break at any time while completing the study to minimize boredom and fatigue.



BENEFITS

There are no benefits to you as a participant other than to further research about help-seeking for mental health.



CONFIDENTIALITY

The data in this study will be confidential. If you decide that you do not wish to participate in this study, we will delete any information about you from our database as soon as possible and typically within 5 business days.

If you agree to participate in this study, every reasonable effort will be made to protect the confidentiality of the information you share with the study team (that is, to protect this information from being seen by individuals with whom you do not consent to share it). While it is understood that no computer transmission can be perfectly secure, reasonable efforts will be made to protect the confidentiality of your transmission. We take the following steps to help maintain your confidentiality:

Your name and email address is provided by Sona when you sign up for a study timeslot and this information stays in Sona. This information is periodically deleted by the Sona team. Your questionnaire responses will be collected using Qualtrics, Qualtrics maintains the highest security standards, including encrypted data transfer (preventing hacker interception), password-required access to data, and a secure survey environment (writing responses directly to their computer server, leaving no trace on participants’ computers). See Qualtrics.com for more details on confidentiality and security.

When you consent, Qualtrics will record a unique StudyID provided by Sona. Your name, email address, and StudyID will be downloaded from Sona and stored in a password-protected file, on a folder within Mason’s OneDrive network that is accessible only by IRB-approved research team members. Your data in Qualtrics will only contain the StudyID and not your name, email address, or any other identifying information.

When we analyze your data, only the StudyID will be included in our analysis files, not your name, email, or anything else that could be used to link your identity to the research data. Your de-identified data (labeled only with the StudyID) will be stored in our database indefinitely for future analysis. We also keep this data so that other scientists who want to double-check our work can do so (but we never give other scientists who aren't part of the research study your name or contact information). The de-identified data could be used for future research without additional consent from participants.

When the results of the research are published or discussed in conferences, no information will be included that would reveal your identity.

The Institutional Review Board (IRB) committee that monitors research on human subjects may inspect study records during internal auditing procedures and are required to keep all information confidential.



How long do we keep your data?

·       For all participants who complete the study: We maintain a list of participants who complete or partially complete this study. The list includes your Name, Email Address and StudyID. We will temporarily use this list to determine if you completed the study so that we can award appropriate credit in Sona. We keep this list separate from the rest of your data, and the list contains no other information about you.

·       If you agree to be contacted about future research opportunities (see below, ""Contact for Future Studies""), we will keep your Name, Email address, and StudyID in a password-protected file that is separate from your data until you indicate that you would like your information removed. You may contact us to ask for your information to be removed using any of the contact methods listed in this form (see below, ""Contact""). In the event that the contact information you provided ceases to be valid, we will also remove you from the linking file.

·       If you indicate that you do not wish to be contacted about future research opportunities (see below, ""Contact for Future Studies""), we will remove your Name and Email Address from the password-protected file at the end of the current academic semester/session. This is to ensure that credit can be properly awarded for participation. Your name and email address will be deleted from any other files that would link your responses to your identity. At that point, your data is ""de-identified,"" meaning that we no longer have any way to match up your questionnaire responses to your identity. Once the semester/session is over and credit is awarded, your data with your survey responses will only be labeled with a unique StudyID.



PARTICIPATION

In order to participate in this study, you must have English language fluency sufficient to complete the consent and survey, must have regular access to the internet, and must have access to a SONA systems account. Participants cannot participate in this study more than once.

Your participation is voluntary, and you may withdraw from the study at any time and for any reason. If you decide not to participate or if you withdraw from the study, there is no penalty or loss of benefits to which you are otherwise entitled. There are no costs to you or any other party.

You will receive 1.5 SONA research credits for completion of the study. If you withdraw from the study before completing more than 50% of the survey, you will receive research credit proportionate to survey completion (minimum 0.5 credits). If agree to participate in this study, but decide not to complete all the survey forms, the researchers may continue to use de-identified information you provided on the surveys prior to that choice. To have your data withdrawn, you can contact the Principal Investigator (see below, ""Contact"") and ask for your data to be removed from the dataset and the data itself destroyed. If you decide you no longer wish for us to have your data, you should contact us as soon as possible; if your entry in the linking file connecting your data to your identity has already been destroyed (see above, ""Confidentiality""), we will not be able to locate the data belonging to you and so will not be able to destroy it.



ALTERNATIVES TO PARTICIPATION

If you choose not to participate in a research study for SONA course credit, please consult with your professor on alternative activities you may complete for course credit.



CONTACT

This research is being conducted by Natasha Tonge, PhD, and Gracie Kelly, B.S., at George Mason University. Gracie may be reached at akelly32@gmu.edu for questions or to report a research-related problem. Dr. Tonge may be reached at ntonge@gmu.edu or (703) 993-6831. You may contact the George Mason University Institutional Review Board office at 703-993-4121 or IRB@gmu.edu if you have questions or comments regarding your rights as a participant in the research. The IRBNet number of this study is: 1974781-1.

This research has been reviewed according to George Mason University procedures governing your participation in this research.



CONSENT

Below you will have the option to agree to participate in the research study, if you agree to future contact about future studies, or to tell us that you do not want to participate and would like for us to delete your contact information from our database.



CONSENT TO CONTACT FOR FUTURE STUDIES

Your responses to the surveys included in this study may indicate that you are eligible to participate in an ongoing or future study conducted by our lab. We may wish to contact you in the future to invite you to participate. Giving your permission for us to contact you again does not obligate you to answer any future questions or to participate in any future research - you will always retain the right to decline further participation in research.","CONSENT



Below you will have the option to agree to participate in the research study, or to tell us that you do not want to participate and would like for us to delete your information from our database.","We care about the quality of our survey data. For us to get the most accurate measures of your opinions, it is important that you provide thoughtful answers to each question in this survey.


Do you commit to providing thoughtful answers to the questions in this survey?","How would you describe your racial, ethnic, and/or national origins?",Which of the following best or most closely describes you?,"If you marked Hispanic/Latino/Latinx, with what origin do you most identify? (Mexican, Puerto Rican, Colombian etc.)","Some people consider themselves bicultural because they identify with at least one cultural, ethnic, or racial group (like Latino, Muslim, Jewish, Brazilian, Arab, White, Black, Haitian, Asian, etc.) and they identify as American. Thinking about this, do you consider yourself bicultural?",Do you speak a language other than English at home?,What is your age?,"If you responded yes above, what other language do you speak?",What is your best estimate for your annual household income?,"Think of this ladder as showing where people stand in their communities.

People define community in different ways. Please define it in whatever way is most meaningful to you.

At the top of the ladder are the people who have the highest standing in their community.

At the bottom are the people who have the lowest standing in their community.

Where would you place yourself on this ladder?

Select the number corresponding to the rung where you think you stand at this time of your life relative to other people in your community.",What is the highest level of education completed by either of your parents (or those who raised you)?,What is the highest level of education you have completed?,Which term best currently describes your gender identity? - Selected Choice,Which term best currently describes your gender identity? - I self-identify as: - Text,Which of the following best describes your sexual orientation? - Selected Choice,Which of the following best describes your sexual orientation? - I self-identify as - Text,Have you ever served in the military? - Selected Choice,Have you ever served in the military? - Other (Please specify) - Text,Do you have a diagnosed disability or impairment? Check any or all that apply: - Selected Choice,Do you have a diagnosed disability or impairment? Check any or all that apply: - Prefer to specify - Text,"Please respond to each question or statement by marking one circle per row. - In general, would you say your health is:","Please respond to each question or statement by marking one circle per row. - In general, would you say your quality of life is:","Please respond to each question or statement by marking one circle per row. - In general, how would you rate your physical health?","Please respond to each question or statement by marking one circle per row. - In general, how would you rate your mental health, including your ability to think?","Please respond to each question or statement by marking one circle per row. - In general, how would you rate your satisfaction with your social activities and relationships?","Please respond to each question or statement by marking one circle per row. - In general, please rate how well you carry out your usual social activities and roles. (This includes activities at home, at work and in your community, and responsibilities as a parent, child, spouse, employee, friend, etc.)","Please respond to each question or statement by marking one circle per row. - To what extent are you able to carry out your everyday physical activities such as walking, climbing stairs, carrying groceries, or moving a chair?","In the past 7 days... - How often have you been bothered by emotional problems such as feeling anxious, depressed or irritable?",In the past 7 days... - How would you rate your fatigue on average?,How would you rate your pain on average? - 1,"If you were having a personal or emotional problem, how likely is it that you would seek help
from the following people?
Please indicate your response by clicking the number that best describes your
intention to seek help from each help source that is listed.

1 = Extremely Unlikely     3 = Unlikely     5 = Likely     7 = Extremely Likely - Intimate partner (e.g. girlfriend, boyfriend, husband, wife, de' facto)","If you were having a personal or emotional problem, how likely is it that you would seek help
from the following people?
Please indicate your response by clicking the number that best describes your
intention to seek help from each help source that is listed.

1 = Extremely Unlikely     3 = Unlikely     5 = Likely     7 = Extremely Likely - Friend (not related to you)","If you were having a personal or emotional problem, how likely is it that you would seek help
from the following people?
Please indicate your response by clicking the number that best describes your
intention to seek help from each help source that is listed.

1 = Extremely Unlikely     3 = Unlikely     5 = Likely     7 = Extremely Likely - Parent","If you were having a personal or emotional problem, how likely is it that you would seek help
from the following people?
Please indicate your response by clicking the number that best describes your
intention to seek help from each help source that is listed.

1 = Extremely Unlikely     3 = Unlikely     5 = Likely     7 = Extremely Likely - Other relative/family member","If you were having a personal or emotional problem, how likely is it that you would seek help
from the following people?
Please indicate your response by clicking the number that best describes your
intention to seek help from each help source that is listed.

1 = Extremely Unlikely     3 = Unlikely     5 = Likely     7 = Extremely Likely - Mental health professional (e.g. psychologist, social worker, counselor)","If you were having a personal or emotional problem, how likely is it that you would seek help
from the following people?
Please indicate your response by clicking the number that best describes your
intention to seek help from each help source that is listed.

1 = Extremely Unlikely     3 = Unlikely     5 = Likely     7 = Extremely Likely - Phone helpline (e.g. Lifeline)","If you were having a personal or emotional problem, how likely is it that you would seek help
from the following people?
Please indicate your response by clicking the number that best describes your
intention to seek help from each help source that is listed.

1 = Extremely Unlikely     3 = Unlikely     5 = Likely     7 = Extremely Likely - Doctor/GP","If you were having a personal or emotional problem, how likely is it that you would seek help
from the following people?
Please indicate your response by clicking the number that best describes your
intention to seek help from each help source that is listed.

1 = Extremely Unlikely     3 = Unlikely     5 = Likely     7 = Extremely Likely - Minister or religious leader (e.g. Priest, Rabbi, Chaplain)","If you were having a personal or emotional problem, how likely is it that you would seek help
from the following people?
Please indicate your response by clicking the number that best describes your
intention to seek help from each help source that is listed.

1 = Extremely Unlikely     3 = Unlikely     5 = Likely     7 = Extremely Likely - I would not seek help from anyone","If you were having a personal or emotional problem, how likely is it that you would seek help
from the following people?
Please indicate your response by clicking the number that best describes your
intention to seek help from each help source that is listed.

1 = Extremely Unlikely     3 = Unlikely     5 = Likely     7 = Extremely Likely - I would seek help from another not listed above (please list in the space provided, e.g. work colleague. If no, leave blank)","If you were having a personal or emotional problem, how likely is it that you would seek help
from the following people?
Please indicate your response by clicking the number that best describes your
intention to seek help from each help source that is listed.

1 = Extremely Unlikely     3 = Unlikely     5 = Likely     7 = Extremely Likely - I would seek help from another not listed above (please list in the space provided, e.g. work colleague. If no, leave blank) - Text","If you were experiencing suicidal thoughts, how likely is it that you would seek help from the
following people?
Please indicate your response by selecting the number that best describes your
intention to seek help from each help source that is listed.

1 = Extremely Unlikely      3 = Unlikely      5 = Likely      7 = Extremely Likely - Intimate partner (e.g. girlfriend, boyfriend, husband, wife, de' facto)","If you were experiencing suicidal thoughts, how likely is it that you would seek help from the
following people?
Please indicate your response by selecting the number that best describes your
intention to seek help from each help source that is listed.

1 = Extremely Unlikely      3 = Unlikely      5 = Likely      7 = Extremely Likely - Friend (not related to you)","If you were experiencing suicidal thoughts, how likely is it that you would seek help from the
following people?
Please indicate your response by selecting the number that best describes your
intention to seek help from each help source that is listed.

1 = Extremely Unlikely      3 = Unlikely      5 = Likely      7 = Extremely Likely - Parent","If you were experiencing suicidal thoughts, how likely is it that you would seek help from the
following people?
Please indicate your response by selecting the number that best describes your
intention to seek help from each help source that is listed.

1 = Extremely Unlikely      3 = Unlikely      5 = Likely      7 = Extremely Likely - Other relative/family member","If you were experiencing suicidal thoughts, how likely is it that you would seek help from the
following people?
Please indicate your response by selecting the number that best describes your
intention to seek help from each help source that is listed.

1 = Extremely Unlikely      3 = Unlikely      5 = Likely      7 = Extremely Likely - Mental health professional (e.g. psychologist, social worker, counsellor)","If you were experiencing suicidal thoughts, how likely is it that you would seek help from the
following people?
Please indicate your response by selecting the number that best describes your
intention to seek help from each help source that is listed.

1 = Extremely Unlikely      3 = Unlikely      5 = Likely      7 = Extremely Likely - Phone helpline (e.g. Lifeline)","If you were experiencing suicidal thoughts, how likely is it that you would seek help from the
following people?
Please indicate your response by selecting the number that best describes your
intention to seek help from each help source that is listed.

1 = Extremely Unlikely      3 = Unlikely      5 = Likely      7 = Extremely Likely - Doctor/GP","If you were experiencing suicidal thoughts, how likely is it that you would seek help from the
following people?
Please indicate your response by selecting the number that best describes your
intention to seek help from each help source that is listed.

